Title,Release date,Time Era,Time Period,Notes on setting,Location
Cathedral of the Sea,2018,medieval era,1320–1370,"The action takes place in 14th century Barcelona at the height of the city's trade and military power in the Mediterranean, during the construction of Santa Maria del Mar serving as background to the story.",Barcelona
Anchoress,1993,medieval era,1325,An anchorite,France
Journey to Mecca,2009,medieval era,1325,A dramatised documentary film charting the first real-life journey made by the Islamic scholar Ibn Battuta from his native Morocco to Mecca for the Hajj,Middle-East
The Name of the Rose,1986,medieval era,1327,set in an Italian monastery,Italy
The Name of the Rose,2019,medieval era,1327,Miniseries set in an Italian monastery. A dispute over the evangelical counsel of poverty between representatives of the Franciscan Order and the Avignon Papacy,Italy
World Without End,2012,medieval era,1327–1361,"A sequel to the 2010 miniseries The Pillars of the Earth, set in England during the 1300s",England
Kazimierz Wielki,1976,medieval era,1333–1370,Casimir III the Great of Poland,Poland
The Decameron,1971,medieval era,1348,based on the novel Il Decameron by Giovanni Boccaccio.,Italy
Black Death,2010,medieval era,1348,During the initial outbreak of the plague,England
The Seventh Seal,1957,medieval era,1351,During the initial outbreak of the plague,Sweden
Du Guesclin,1948,medieval era,1354–1380,"Bertrand du Guesclin, a Constable of France in the Hundred Years' War",France
A Knight's Tale,2001,medieval era,1356,"loose adaptation of The Knight's Tale by Geoffrey Chaucer, this tale is partially inspired by the exploits of William Marshall, but set in the 1350s (with mention made to Edward, the Black Prince and the Battle of Poitiers (1356))",England
A Walk with Love and Death,1969,medieval era,1358,Angelica Huston in the turmoil of the Jacquerie,France
The Dark Avenger,1955,medieval era,1359,"Edward, the Black Prince",England
Andrei Rublev,1966,medieval era,1360–1430,"about the life of Andrei Rublev, who was considered to be the greatest medieval Russian painter of icons and frescoes",Russia
John Wycliffe: The Morning Star,1984,medieval era,1378–1384,"the life and teachings of John Wycliffe, the 14th-century English theologian who is often seen as a fore-runner of the Protestant Reformation",England
The Reckoning,2003,medieval era,1380,"A priest on the lam takes up with a traveling band of actors, who then discover a murder has occurred and try to solve it by recreating the crime in a play.",England
Mircea,1989,medieval era,1386–1418,"Mircea the Elder, who repelled the Ottoman Empire during his reign",Wallachia
Boj na Kosovu,1989,medieval era,1389,a battle between Medieval Serbia and the Ottoman Empire,Serbia
Banovi? Strahinja,1983,medieval era,1389,a battle between Medieval Serbia and the Ottoman Empire,Serbia
The Hollow Crown,2012–2016,medieval era,1398–1485,"series of films based on Shakespeare's plays depicting the lives of Richard II of England, Henry IV of England, Henry V of England, Henry VI of England, and Richard III of England",England
The Canterbury Tales,1972,medieval era,late 14th century,Based on the medieval narrative poem The Canterbury Tales by Geoffrey Chaucer.,England
The Last Duel,2021,medieval era,1390,Based on the book The Last Duel: A True Story of Trial by Combat in Medieval France by Eric Jager.,France
Viy,1967,Renaissance era,16th century,"Soviet horror film set in 16th century Ukraine, based on the story of the same name by Nikolai Gogol.",Ukraine
The Spanish Princess (TV series),2019,Renaissance era,1501–1509,Catherine of Aragon,Aragon
Apocalypto,2006,Renaissance era,1502,"Yucatán Peninsula, Mexico, the declining period of the Maya civilization.",Mexico
La corona partida,2016,Renaissance era,1504–1516,"After the death of Queen Isabella I of Castile, both Ferdinand II of Aragon and Felipe el Hermoso fight to succeed her.",Castile
Luther,2003,Renaissance era,1505–1530,Martin Luther,Germany
The Agony and the Ecstasy,1965,Renaissance era,1508–1512,The painting of the Sistine Chapel.,Vatican
The Six Wives of Henry VIII,1970,Renaissance era,1509–1547,Henry VIII of England,England
Henry VIII and His Six Wives,1972,Renaissance era,1509–1547,Henry VIII of England,England
The Private Life of Henry VIII,1933,Renaissance era,1509–1547,Henry VIII of England,England
Monarch,2000,Renaissance era,1509–1547,Henry VIII of England,England
Henry VIII,2003,Renaissance era,1509–1547,Henry VIII of England,England
Nostradamus,1994,Renaissance era,1510–1566,The life story of Nostradamus.,France
The Tudors,2007–2010,Renaissance era,1514–1547,Henry VIII of England,England
Judgement,1970,Renaissance era,1514,"Rebellion of György Dózsa, Hungary.",Hungary
"Carlos, rey emperador",2015–2016,Renaissance era,1516–1558,"The series tells the story of Charles I or Charles V, Holy Roman Emperor, one of the most powerful men Europe has met.",Roman
The Other Conquest,1998,Renaissance era,1521,"Mexico, depicting the secret adherence to traditional religious beliefs of the converted Aztec survivors.",Mexico
Diane,1956,Renaissance era,1523–1559,Based on the relationship between Diane de Poitiers and Henry II of France.,France
Anne of the Thousand Days,1969,Renaissance era,1524–1536,"Anne Boleyn, Queen Consort of King Henry VIII and the mother of Queen Elizabeth I.",London
The Headsman,2005,Renaissance era,1525,An executioner in Tyrol (part of the Holy Roman Empire).,London
A Man for All Seasons,1966,Renaissance era,1525–1535,Thomas More,London
Wolf Hall,2015,Renaissance era,1529–1536,The court of Henry VIII of England through the eyes of Thomas Cromwell.,UK
Ivan the Terrible,"1944, 1958",Renaissance era,1530–1584,Two-part film about Ivan IV of Russia.,Russua
Ivan Groznyy,2009,Renaissance era,1530–1584,16-episodes TV Series about Ivan IV of Russia.,Russia
Tsar,2009,Renaissance era,1530–1584,Film about Ivan IV of Russia.,Russia
The Royal Hunt of the Sun,1969,Renaissance era,1532,"Francisco Pizarro's capture of Atahualpa, Sapa Inca.",Peru
Wara Wara,1930,Renaissance era,1535,Romance set at the time of the Spanish conquest of Bolivia.,Bolivia
Young Bess,1953,Renaissance era,1536–1558,From the death of Anne Boleyn to the coronation of Elizabeth I of England.,England
Jodhaa Akbar,2008,Renaissance era,1542–1605,"The love story of Mughal emperor Akbar the Great and Rajput princess ""Jodhaa"" i.e. Empress Mariam uz-Zamani.",Agra
"Gunpowder, Treason & Plot",2004,Renaissance era,1542–1605,"The reigns of Mary, Queen of Scots and her son James I of England.",England
The Prince and the Pauper (many adaptations),1909-,Renaissance era,1547,"Mark Twain's novel, featuring a fictional portrayal of Edward VI of England.",England
The Return of Martin Guerre,1982,Renaissance era,1548–1588,The case of Martin Guerre in France – a true case of identity theft.,France
Stars of Eger,1968,Renaissance era,1552,"During the Ottoman–Hungarian wars, after the Ottomans have taken Buda, the Hungarian Capital (in 1541), the siege of Eger (1552).",Budapest
Tudor Rose (Nine Days a Queen),1936,Renaissance era,1553,"About Lady Jane Grey, Queen Regnant of the Kingdom of England for nine days.",England
Lady Jane,1986,Renaissance era,1553,"About Lady Jane Grey, Queen Regnant of the Kingdom of England for nine days.",England
Elizabeth,1998,Renaissance era,1554–1563,The early reign of Elizabeth I of England.,England
Mughal-e-Azam,1960,Renaissance era,1556–1605,"The Story of Akbar the Great, Mughal emperor and his son Jahangir. Jahangir's relationship with slave girl Anarkali is featured.",Agra
Reign (TV series),2013–2017,Renaissance era,1557–1587,"78-episode TV series about Mary, Queen of Scots and Elizabeth I of England.",England
Elizabeth R,1971,Renaissance era,1558–1603,The reign of Elizabeth I of England.,England
The Virgin Queen,2005,Renaissance era,1558–1603,The reign of Elizabeth I of England.,England
"Aguirre, the Wrath of God",1972,Renaissance era,1560,Lope de Aguirre's ill-fated expedition down the Amazon in search of El Dorado.,Peru
"Mary, Queen of Scots",1971,Renaissance era,1560–1587,"Mary, Queen of Scots",England
Mary of Scotland,1936,Renaissance era,1561–1587,"Mary, Queen of Scots",England
"Mary, Queen of Scots",2018,Renaissance era,1561–1587,"Mary, Queen of Scots",England
Dangerous Beauty,1998,Renaissance era,1562–1583,"The film is about Veronica Franco, a courtesan in 16th-century Venice who becomes a hero to her city, but later becomes the target of an inquisition by the Church for witchcraft.[3]",Venice
The Mill and the Cross,2011,Renaissance era,1564,Life in Flanders under Spanish Habsburg rule as depicted in Pieter Bruegel the Elder's 1564 painting The Procession to Calvary.,Spain
El Greco,2007,Renaissance era,1567–1600,"Greek biographical film about the life of the Greek painter of the Spanish Renaissance, Doménikos Theotokópoulos, known as El Greco.",Spain
Anonymous,2011,Renaissance era,1570–1604,"Life of Edward de Vere, 17th Earl of Oxford, an Elizabethan courtier, playwright, poet and patron of the arts, suggested as the actual author of William Shakespeare's plays.",England
La Reine Margot,1954,Renaissance era,1572,France during the St. Bartholomew's Day massacre. The massacre was part of the French Wars of Religion.,France
La Reine Margot,1994,Renaissance era,1572,France during the St. Bartholomew's Day massacre. The massacre was part of the French Wars of Religion.,France
The Princess of Montpensier,2010,Renaissance era,1572,France during the St. Bartholomew's Day massacre. The massacre was part of the French Wars of Religion.,France
Beatrice Cenci,1909,Renaissance era,1577–1599,About the life events of Beatrice Cenci.,Rome
Beatrice Cenci,1926,Renaissance era,1577–1599,About the life events of Beatrice Cenci.,Rome
Beatrice Cenci,1941,Renaissance era,1577–1599,About the life events of Beatrice Cenci.,Rome
Beatrice Cenci,1956,Renaissance era,1577–1599,About the life events of Beatrice Cenci.,Rome
Beatrice Cenci,1969,Renaissance era,1577–1599,It depicts real life events of Francesco and Beatrice Cenci.,Rome
Elizabeth I,2005,Renaissance era,1578–1603,The last 25 years of the reign of Elizabeth I of England.,England
Ermak,1996,Renaissance era,1580–1690,Yermak Timofeyevich and the Russian conquest of Siberia.,Siberia
Elizabeth: The Golden Age,2007,Renaissance era,1585–1590,The reign of Elizabeth I of England and the Spanish Armada.,England
The Testament of Aga Koppanyi,1967,Renaissance era,1586,"Hungarian adventure film based on the eponymous novel by István Fekete. It talks about the adventourous life of the Hungarian soldiers in the Ottoman Hungary, during the Ottoman–Hungarian wars.",Hungary
Fire Over England,1937,Renaissance era,1588,The Spanish Armada during the Anglo-Spanish War.,Spain
Shakespeare in Love,1998,Renaissance era,1593,Fictional love affair involving playwright William Shakespeare and Viola de Lesseps while Shakespeare was writing Romeo and Juliet.,England
Mihai Viteazul,1970,Renaissance era,1593–1601,"Michael the Brave, prince of Wallachia, Moldavia and Transylvania.",Transylvania
The Merchant of Venice,2004,Renaissance era,1596,Set in the Republic of Venice. The film focuses on the Venetian Ghetto.,Venice
Nova Zembla,2011,Renaissance era,1596–1597,"About the last journey of Willem Barentsz and Jacob van Heemskerk, when they and their crew attempted sail to the Indies via Northeast Passage over Russia. They were stranded on the island of Nova Zembla.",Nova Zembla
The Private Lives of Elizabeth and Essex,1939,Renaissance era,1596–1601,"Elizabeth I of England and Robert Devereux, 2nd Earl of Essex.",England
Sh?gun,1980,Renaissance era,1600-,"Miniseries adaptation of the novel by James Clavell, which is loosely based on the adventures of English navigator William Adams, who journeyed to Japan in 1600 and rose to high rank in the service of the sh?gun.",Japan
Gunpowder,2017,Renaissance era,1603–1605,English Catholic Robert Catesby and the Gunpowder Plot,England
The New World,2005,Renaissance era,1607–1608,"The colonization of Jamestown, Virginia",Virgina
1612,2007,Renaissance era,1612,The Tsardom of Russia during the Time of Troubles,Russia
All Is True,2018,Renaissance era,1613–1616,later years in the life of William Shakespeare,England
The Last Valley,1970,Renaissance era,1618–1648,"Set in the Kingdom of Germany, Holy Roman Empire during the Thirty Years' War.",Germany
Harakiri,1962,Renaissance era,1619–1630,Set in Japan during the Edo period,Japan
Jamestown,2017–2019,Renaissance era,1619–1622,"The colonization of Jamestown, Virginia",Virgina
Molière,1978,Renaissance era,1622–1673,The French playwright Molière,France
Day of Wrath,1943,Renaissance era,1624,"Loosely based on the case of alleged witch Anne Pedersdotter, and using a fictitious witchcraft trial as a metaphor for the then-current Nazi persecution of Jews.",Salem
The Three Musketeers,Several adaptations (1903–2014),Renaissance era,1625–1673,"Based on the novels (The Three Musketeers and its sequels) by Alexandre Dumas. The protagonists are loosely based on historical figures Charles de Batz-Castelmore d'Artagnan, Armand d'Athos, Isaac de Porthau, and Henri d'Aramitz.",France
Cardinal Richelieu,1935,Renaissance era,1626–1642,The life of the great 17th-century French statesman Cardinal Richelieu and his dealings with Louis XIII of France,France
Silence,2016,Renaissance era,1630s–1638,Jesuit priests from Portugal attempt to spread Catholic Christianity in Edo-era Japan,Japan
Queen Christina,1933,Renaissance era,1632–1654,"Christina, Queen of Sweden",Sweden
Le Roi danse,2000,Renaissance era,1632–1687,"Jean-Baptiste Lully, an Italian immigrant to France and noted composer of Baroque music.",France
Black Robe,1991,Renaissance era,1634,Jesuit missionary among the Hurons.,wendake
The Devils,1971,Renaissance era,1634,"The life and trial of Urbain Grandier, who was convicted of witchcraft and burned. He was blamed for the Loudun possessions.",France
The Devil's Whore,2008,Renaissance era,1638–1660,The English Civil War and the reign of Oliver Cromwell,England
Witchfinder General,1968,Renaissance era,1640s,"Set during the English Civil War. A fictionalized depiction of Matthew Hopkins, a witch-hunter.",England
Admiral,2015,Renaissance era,1640s–1650s,The life of Michiel de Ruyter and the Dutch civil war,Netherlands
A Field in England,2013,Renaissance era,1640s,During the English Civil War,England
Barbara,1997,Renaissance era,1640,"Set in Faroe Islands. About a love triangle between the pastor for the parish of Vágar, his unfaithful wife, and her foppish lover.",Faroe Islands
Cromwell,1970,Renaissance era,1640–1653,The English Civil War and the dissolution of the Rump Parliament,England
Alatriste,2006,Renaissance era,1643,Life of a Spanish soldier (Capitaine Alatriste) until the Battle of Rocroi. Based on the novel by Arturo Perez-Reverte,Spain
Molière,2007,Renaissance era,1645,The French playwright Molière,France
The Libertine,2004,Renaissance era,1647–1680,"Life of the poet John Wilmot, 2nd Earl of Rochester",France
With Fire and Sword,1999,Renaissance era,1648–1654,The Khmelnytsky uprising in Ukraine against the control of the Polish–Lithuanian Commonwealth. It led to the period of the Commonwealth known as the Deluge.,Ukraine
To Kill a King,2003,Renaissance era,1648–1658,"The reign of Oliver Cromwell, Lord Protector.",England
Charles II: The Power and The Passion,2003,Renaissance era,1649–1685,The reign of Charles II of England,England
The First Churchills,1969,Renaissance era,1650–1722,"A BBC serial about the life of John Churchill, 1st Duke of Marlborough and his wife, Sarah Churchill, Duchess of Marlborough",England
The Deluge,1974,Renaissance era,1655–1660,The Polish–Lithuanian Commonwealth during the Second Northern War,Poland
The Man in the Iron Mask,1977,Renaissance era,1660–1667,Loosely based on the existence of the Man in the Iron Mask. Set in France in the reign of Louis XIV,France
Versailles,2015,Renaissance era,1660s,Fictionalized drama about the reign of King Louis XIV of France and the building of Versailles,France
Cutthroat Island,1995,Renaissance era,1668,A female pirate and her companion race against their rivals to find a hidden island that contains a fabulous treasure.,jamaca
Colonel Wolodyjowski,1968,Renaissance era,1668,"The Ottoman invasion of the Polish–Lithuanian Commonwealth, part of the Polish–Ottoman Wars.",Poland
Time of Violence,1988,Renaissance era,1668,Bulgarian Christian region is selected by the Ottoman rulers to serve as an example of conversion to Islam,Bulgaria
Vatel,2000,Renaissance era,1671,France during the life of master chef François Vatel,France
The Prince of Homburg,1997,Renaissance era,1675,"Adaptation of the Heinrich von Kleist play fictionalizing the deeds of Frederick II, Landgrave of Hesse-Homburg in the Battle of Fehrbellin against Sweden. The Battle was part of the Scanian War.",Sweden
Witchhammer,1970,Renaissance era,1678–1696,Northern Moravia witch trials,czech republic
The Red Violin,1998,Renaissance era,1681,One section of the film is set in 1681 in Cremona,Cremona
A Little Chaos,2014,Renaissance era,1682,King Louis XIV of France and the design and construction of the Gardens of Versailles,Gardens of Versailles
Peter the Great,1984,Renaissance era,1682–1725,The reign of Peter I of Russia,Russia
The Day of the Siege: September Eleven 1683,2012,Renaissance era,1683,Second ottoman siege of Vienna.,Vienna
The Cantor of St Thomas's,1984,Renaissance era,1685–1750,German composer Johann Sebastian Bach,Germany
The Crucible,1996,Renaissance era,1692–1693,Dramatization of the Salem witch trials that took place in Province of Massachusetts Bay,Massachusetts
The Draughtsman's Contract,1982,Renaissance era,1694,Set during the reign of William III and Mary II in England.,England
Robinson Crusoe,1997,Renaissance era,1694–early 18th century,Robinson Crusoe flees Britain on a ship after killing his friend over love for the same woman. A fierce ocean storm wrecks his ship and leaves him stranded by himself on an uncharted island where he must fight for survival.,England
Tous les matins du monde,1991,Renaissance era,late 17th century,French composer Monsieur de Sainte-Colombe.,France
The Favourite,2018,industrial era,1708,"A frail Queen Anne occupies the throne and her close friend, Lady Sarah, governs the country in her stead. When a new servant, Abigail, arrives, her charm endears her to Sarah.",England
Rákóczi hadnagya,1954,industrial era,1708,Adventure movie in Hungary during Rákóczi's War of Independence (1703–11).,Hungary
The Sovereign's Servant,2007,industrial era,1709,The Battle of Poltava during the Great Northern War.,Russia
Rob Roy: The Highland Rogue,1953,industrial era,1713,Scottish folk hero Robert Roy MacGregor,Scotland
Rob Roy,1995,industrial era,1713,Scottish folk hero Robert Roy MacGregor,Scotland
Black Sails,2014–2017,industrial era,1715–1726,Set roughly two decades before the events of Treasure Island and during the Golden Age of Piracy,nassau
Blackbeard,2006,industrial era,1718,the infamous pirate Edward Teach,nassau
Maria Theresia,2017,industrial era,1723–1741,Depicts the life of the young Maria Theresa,Austria
King of the Wind,1990,industrial era,1727,"Depicts the life of the Godolphin Arabian, an Arabian colt in 18th-century Kingdom of Great Britain during the reign of George II of Great Britain.",England
The Great King,1942,industrial era,1740–1786,It depicts the life of Frederick the Great,Germany
Maria Theresa,1951,industrial era,1740–1780,Depicts the life of Maria Theresa,Austria
Joseph Andrew,1977,industrial era,1742,An adaption of the novel Joseph Andrews by Henry Fielding.,England
Outlander (TV series),2014,industrial era,1743–ongoing,Depicts events leading up to the Jacobite Rising of 1745,England
George Washington,1984,industrial era,1743–1783,George Washington's life up to the American Revolutionary War,"Westmoreland County, VA"
The Scarlet Empress,1934,industrial era,1744–1762,Catherine II of Russia,Russia
The Rise of Catherine the Great,1934,industrial era,1744–1762,Catherine II of Russia,Russia
Young Catherine,1991,industrial era,1744,Catherine II of Russia,Russia
Catherine the Great,1995,industrial era,1744–1762,Catherine II of Russia,Russia
Ekaterina,2014–2019,industrial era,1744–1782,Catherine II of Russia,Russia
The Master of Ballantrae,1953,industrial era,1745–1746,Jacobite Rising of 1745,England
Culloden,1964,industrial era,1745–1746,Jacobite Rising of 1745,England
The Master of Ballantrae,1984,industrial era,1745–1746,Jacobite Rising of 1745,England
Chasing the Deer,1994,industrial era,1745–1746,Jacobite Rising of 1745,England
Mein Name ist Bach,2003,industrial era,1747,"Depicts Johann Sebastian Bach's visit to Frederick the Great in Potsdam, Prussia, when The Musical Offering was composed.",Germany
Horseman,2003,industrial era,1747,"Set in the borders between the regions of Bosnia and Dalmatia, the crossroads of the Ottoman Empire and the Republic of Venice. It deals with issues relating to the region's native Croats as they struggle to live between two empires and two faiths: Catholicism and Islam. Also covers the possibility of a love affair between a Christian soldier and a Muslim noblewoman.",Germany
The Amazing Grace,2006,industrial era,1748,"Tells the story of John Newton's transformation from slave trader to Anglican priest; story is set in Calabar, Nigeria.",Nigeria
Plunkett & Macleane,1999,industrial era,1748,Loosely based on The Gentlemen Highwaymen William Plunkett and Captain James MacLaine. They were highwaymen noted for their restrained and courteous behavior towards their victims.,Plunketts Creek
Treasure Island,1934,industrial era,1750,Adaptation of the famous pirate story by Robert Louis Stevenson,nassau
Treasure Island,1950,industrial era,1750,Adaptation of the famous pirate story by Robert Louis Stevenson,nassau
Treasure Island,1972,industrial era,1750,Adaptation of the famous pirate story by Robert Louis Stevenson,nassau
Treasure Island,1990,industrial era,1750,Adaptation of the famous pirate story by Robert Louis Stevenson,nassau
Casanova,2005,industrial era,1753–1757,Giacomo Casanova,France
Lady Oscar,1979,industrial era,1755–1789,"The woman Oscar François de Jarjayes is raised as a man by her father, later gaining a career as a guard for Marie Antoinette.",France
A Tale of Two Cities,1911,industrial era,1755–1792,England and France prior and during the French Revolution.,France
A Tale of Two Cities,1935,industrial era,1755–1792,England and France prior and during the French Revolution.,France
A Tale of Two Cities,1958,industrial era,1755–1792,England and France prior and during the French Revolution.,France
A Tale of Two Cities,1980,industrial era,1755–1792,England and France prior and during the French Revolution.,France
Amadeus,1984,industrial era,1756–1791,Austria composer Wolfgang Amadeus Mozart,Austria
Barry Lyndon,1975,industrial era,1756–1789,"The Seven Years' War, etc.",North America
The Last of the Mohicans,1936,industrial era,1757,French and Indian War,Quebec
The Last of the Mohicans,1992,industrial era,1757,French and Indian War,Quebec
Northwest Passage,1940,industrial era,1757,French and Indian War and the ranger campaign of Robert Rogers,Quebec
Clive of India,1935,industrial era,1757,"Robert Clive, Commander-in-Chief, India and the Battle of Plassey. The Battle was part of the Carnatic Wars.",Palashi
The Mission,1986,industrial era,1760–1763,Jesuit missionaries in South America,Paraguay 
Belle,2013,industrial era,1761–1804,"The true history of Dido Elizabeth Belle, a mixed–race daughter of British Naval officer John Lindsay and an African woman. She was taken to England by her father to be raised by his uncle, William Murray, 1st Earl of Mansfield, as an aristocratic Lady, as befits her blood line. This forces Lord Mansfield, the Lord Chief Justice, to confront his own views on race, society and the antiquated laws of the time.",England
Mozart's Sister,2010,industrial era,1763,"The early life of Maria Anna Mozart, older sister of Wolfgang Amadeus Mozart.",Austria
Unconquered,1947,industrial era,1763,Pontiac's War focusing on the Siege of Fort Pitt.,Fort Pitt
Brotherhood of the Wolf,2001,industrial era,1764–1767,Based on a real-life series of killings that took place in France in the 18th century and on the famous legend of the Beast of Gévaudan,France
Catherine the Great,2019,industrial era,1764–1796,Catherine II of Russia,Russia
Sons of Liberty,2015,industrial era,1765–1776,A story about the Founding Fathers of the United States and the American Revolution.,northeastern united states
A Royal Affair,2012,industrial era,1766–1783,"Set at the court of the mentally ill King Christian VII of Denmark, and focuses on the romance between his wife, Caroline Matilda of Great Britain, and the royal physician Johann Friedrich Struensee.",Denmark
John Adams,2008,industrial era,1770–1826,The story about the American Founding Father John Adams from the Boston massacre in 1770 to his death in 1826.[4],Boston
Louis van Beethoven,2020,industrial era,1770s–1827,"Life of Ludwig van Beethoven, called Louis in family",Bonn
The Duchess,2008,industrial era,1774–1806,"The life of Georgiana Cavendish, Duchess of Devonshire",Devonshire
